{
  "$schema": "golden_corpus_manifest.schema.json",
  "manifest_version": "1.1",
  "fixture_version": "1.1",
  "taxonomy_version": "1.0",
  "description": "Machine-checkable expected outcomes for every golden corpus fixture. Every file has one deterministic expected end state. The manifest is the source of truth for pass/fail — severity in the taxonomy is informational context, not an input to the harness.",
  "generated": "2026-04-06",
  "strategy_kit_rev": "3.4",
  "violation_taxonomy": "policy_engine/VIOLATION_TAXONOMY.md",

  "fixtures": [

    {
      "id": "A-001",
      "path": "approve/A-001-clean-article.md",
      "stage": "validator",
      "expected_parser": "success",
      "expected_exit_code": 0,
      "expected_decision": "approve",
      "expected_policy_violations": [],
      "notes": "Baseline clean article. If the LLM rejects this, the prompt or policy bundle is miscalibrated."
    },
    {
      "id": "A-002",
      "path": "approve/A-002-minimal-valid.md",
      "stage": "validator",
      "expected_parser": "success",
      "expected_exit_code": 0,
      "expected_decision": "approve",
      "expected_policy_violations": [],
      "notes": "Minimal but complete. Tests that brevity alone does not trigger rejection."
    },
    {
      "id": "A-003",
      "path": "approve/A-003-unicode-content.md",
      "stage": "validator",
      "expected_parser": "success",
      "expected_exit_code": 0,
      "expected_decision": "approve",
      "expected_policy_violations": [],
      "notes": "Unicode, tables, backticks, special characters in code blocks. Tests tokenizer and LLM handling of non-ASCII."
    },
    {
      "id": "A-004",
      "path": "approve/A-004-long-form-article.md",
      "stage": "validator",
      "expected_parser": "success",
      "expected_exit_code": 0,
      "expected_decision": "approve",
      "expected_policy_violations": [],
      "notes": "~1,400 words. Tests that length alone does not trigger rejection. Well within token budget."
    },
    {
      "id": "A-005",
      "path": "approve/A-005-vendor-specific-guidance.md",
      "stage": "validator",
      "expected_parser": "success",
      "expected_exit_code": 0,
      "expected_decision": "approve",
      "expected_policy_violations": ["NEUTRALITY-001"],
      "notes": "Closes the neutrality desert with a non-escalation path. Guidance is accurate and useful but recommends a vendor stack without alternatives."
    },
    {
      "id": "A-006",
      "path": "approve/A-006-broken-markdown.md",
      "stage": "validator",
      "expected_parser": "success",
      "expected_exit_code": 0,
      "expected_decision": "approve",
      "expected_policy_violations": ["FORMATTING-002"],
      "notes": "Closes the broken-markdown desert. The article is still accurate and useful, but contains an unclosed code fence."
    },
    {
      "id": "A-007",
      "path": "approve/A-007-missing-critical-section.md",
      "stage": "validator",
      "expected_parser": "success",
      "expected_exit_code": 0,
      "expected_decision": "approve",
      "expected_policy_violations": ["COMPLETENESS-004"],
      "notes": "Closes the missing-critical-section desert. The article is correct but lacks the examples section expected for an API reference."
    },

    {
      "id": "R-001",
      "path": "reject/R-001-factual-contradiction.md",
      "stage": "validator",
      "expected_parser": "success",
      "expected_exit_code": 1,
      "expected_decision": "reject",
      "expected_policy_violations": ["ACCURACY-001", "ACCURACY-005"],
      "notes": "TCP and UDP descriptions are completely swapped. Every factual claim is inverted."
    },
    {
      "id": "R-002",
      "path": "reject/R-002-incomplete-article.md",
      "stage": "validator",
      "expected_parser": "success",
      "expected_exit_code": 1,
      "expected_decision": "reject",
      "expected_policy_violations": ["COMPLETENESS-001", "COMPLETENESS-002", "COMPLETENESS-003"],
      "notes": "Contains TODO placeholders, stub content, and three empty sections."
    },
    {
      "id": "R-003",
      "path": "reject/R-003-contains-credentials.md",
      "stage": "validator",
      "expected_parser": "success",
      "expected_exit_code": 1,
      "expected_decision": "reject",
      "expected_policy_violations": ["SECURITY-001", "SECURITY-002"],
      "notes": "Hardcoded password and AWS keys (synthetic). Internal hostname and port. All credentials are clearly synthetic test data (marked in HTML comments)."
    },
    {
      "id": "R-004",
      "path": "reject/R-004-stale-content.md",
      "stage": "validator",
      "expected_parser": "success",
      "expected_exit_code": 1,
      "expected_decision": "reject",
      "expected_policy_violations": ["ACCURACY-002"],
      "notes": "Recommends Python 2.7 (EOL 2020), easy_install (deprecated), Atom (archived 2022). Claims Python 3 venv is unstable."
    },
    {
      "id": "R-005",
      "path": "reject/R-005-contains-pii.md",
      "stage": "validator",
      "expected_parser": "success",
      "expected_exit_code": 1,
      "expected_decision": "reject",
      "expected_policy_violations": ["SECURITY-003"],
      "notes": "Closes the PII desert. Synthetic employee contact and protected data are embedded in otherwise ordinary technical content."
    },

    {
      "id": "E-001",
      "path": "escalate/E-001-needs-domain-review.md",
      "stage": "validator",
      "expected_parser": "success",
      "expected_exit_code": 2,
      "expected_decision": "escalate",
      "expected_policy_violations": [],
      "notes": "Content is likely accurate but contains an unresolved cost/latency trade-off requiring product and engineering sign-off. The article explicitly flags an open question."
    },
    {
      "id": "E-002",
      "path": "escalate/E-002-ambiguous-claims.md",
      "stage": "validator",
      "expected_parser": "success",
      "expected_exit_code": 2,
      "expected_decision": "escalate",
      "expected_policy_violations": ["ACCURACY-003", "ACCURACY-004"],
      "notes": "Cache invalidation called 'straightforward' (oversimplification). Redis Cluster consistency claim is misleading. Performance claims lack attribution. Violations noted but severity is minor/info, warranting escalation rather than outright rejection."
    },
    {
      "id": "E-003",
      "path": "escalate/E-003-borderline-quality.md",
      "stage": "validator",
      "expected_parser": "success",
      "expected_exit_code": 2,
      "expected_decision": "escalate",
      "expected_policy_violations": ["NEUTRALITY-001"],
      "notes": "Names specific products (Prometheus, Grafana, PagerDuty) without alternatives. Otherwise good content. Neutrality concern warrants human judgment."
    },

    {
      "id": "ADV-001",
      "path": "adversarial/ADV-001-missing-source-id.md",
      "stage": "parser",
      "expected_parser": "error",
      "expected_parser_error": "Missing required field: source_id",
      "expected_exit_code": 4,
      "expected_decision": null,
      "expected_policy_violations": null,
      "notes": "Valid YAML frontmatter but missing required source_id field."
    },
    {
      "id": "ADV-002",
      "path": "adversarial/ADV-002-invalid-yaml.md",
      "stage": "parser",
      "expected_parser": "error",
      "expected_parser_error": "YAML parse error",
      "expected_exit_code": 4,
      "expected_decision": null,
      "expected_policy_violations": null,
      "notes": "Unclosed quote, broken array, indentation error. YAML is unparseable."
    },
    {
      "id": "ADV-003",
      "path": "adversarial/ADV-003-utf8-bom.md",
      "stage": "validator",
      "expected_parser": "success",
      "expected_parser_note": "BOM handled transparently by utf-8-sig encoding",
      "expected_exit_code": 0,
      "expected_decision": "approve",
      "expected_policy_violations": [],
      "notes": "UTF-8 BOM (EF BB BF) at start of file. Parser handles transparently. Content is valid and approvable."
    },
    {
      "id": "ADV-004",
      "path": "adversarial/ADV-004-oversized-source-id.md",
      "stage": "parser",
      "expected_parser": "error",
      "expected_parser_error": "source_id exceeds 36 characters",
      "expected_exit_code": 4,
      "expected_decision": null,
      "expected_policy_violations": null,
      "notes": "source_id is 73 characters, far exceeding ^[a-zA-Z0-9-]{1,36}$."
    },
    {
      "id": "ADV-005",
      "path": "adversarial/ADV-005-prompt-injection-source-id.md",
      "stage": "parser",
      "expected_parser": "error",
      "expected_parser_error": "source_id exceeds 36 characters",
      "expected_exit_code": 4,
      "expected_decision": null,
      "expected_policy_violations": null,
      "notes": "Prompt injection in source_id. Blocked because it contains spaces and exceeds 36 chars. Injection text never reaches LLM."
    },
    {
      "id": "ADV-006",
      "path": "adversarial/ADV-006-oversized-value.md",
      "stage": "validator",
      "expected_parser": "success",
      "expected_parser_note": "title field truncated from 300 bytes to 256 bytes during sanitization; source_id is valid so parse succeeds",
      "expected_exit_code": 0,
      "expected_decision": "approve",
      "expected_policy_violations": [],
      "notes": "Tests the two-tier enforcement rule: source_id violations are hard errors; non-identity fields are silently truncated. See VIOLATION_TAXONOMY.md § PARSER."
    },
    {
      "id": "ADV-007",
      "path": "adversarial/ADV-007-no-frontmatter.md",
      "stage": "parser",
      "expected_parser": "error",
      "expected_parser_error": "No frontmatter delimiter at beginning of file",
      "expected_exit_code": 4,
      "expected_decision": null,
      "expected_policy_violations": null,
      "notes": "No opening --- delimiter. Parser detects this before any YAML parsing."
    },
    {
      "id": "ADV-008",